{
  "$schema": "http://json-schema.org/draft-07/schema#",
  "$id": "https://learning-new-things-daily.github.io/devops-hub/schemas/project.schema.json",
  "title": "Projects Array",
  "type": "array",
  "minItems": 1,
  "items": {
    "type": "object",
    "additionalProperties": false,
    "properties": {
      "id": {
        "type": "string",
        "pattern": "^[A-Za-z0-9_-]+$"
      },
      "emoji": { "type": "string", "minLength": 1 },
      "title": { "type": "string", "minLength": 1 },
      "summary": { "type": "string", "minLength": 1 },
      "tags": {
        "type": "array",
        "items": { "type": "string", "minLength": 1 },
        "minItems": 1
      },
      "outcomes": {
        "type": "array",
        "items": { "type": "string", "minLength": 1 },
        "minItems": 1
      },
      "links": {
        "type": "array",
        "items": {
          "type": "object",
          "additionalProperties": false,
          "properties": {
            "label": { "type": "string", "minLength": 1 },
            "url": { "type": "string", "format": "uri-reference" }
          },
          "required": ["label", "url"]
        }
      }
    },
    "required": ["id", "title", "summary"]
  }
}
