[
  {
    "id": "nxtpe",
    "emoji": "üîß",
    "title": "AWS Infrastructure Automation (Nxtpe)",
    "summary": "Reusable Terraform modules for VPC, EC2, RDS, and IAM with Jenkins CI/CD integration.",
    "tags": ["AWS", "Terraform", "Jenkins"],
    "outcomes": [
      "Standardized modules reduced manual provisioning and improved repeatability.",
      "Plan/apply gating increased change confidence and auditability."
    ],
    "links": [
      { "label": "Case study", "url": "projects.html#nxtpe" }
    ]
  },
  {
    "id": "sharechat",
    "emoji": "üìä",
    "title": "Google Cloud Monitoring (ShareChat)",
    "summary": "Configured GCP monitoring metrics, dashboards, and operational documentation.",
    "tags": ["GCP", "Monitoring", "Dashboards"],
    "outcomes": [
      "Actionable SLO dashboards improved visibility for on‚Äëcall workflows.",
      "Aligned alerts with incident response to reduce detection time."
    ],
    "links": [
      { "label": "Case study", "url": "projects.html#sharechat" }
    ]
  },
  {
    "id": "iftas-rebit",
    "emoji": "üõ°Ô∏è",
    "title": "OpenShift CI/CD Automation (IFTAS / REBIT)",
    "summary": "CI/CD automation, security scans, and Quay registry management for OpenShift.",
    "tags": ["OpenShift", "CI/CD", "Security"],
    "outcomes": [
      "Security scans integrated as gates to enforce compliance.",
      "Automated image promotion streamlined multi‚Äëenv releases."
    ],
    "links": [
      { "label": "Case study", "url": "projects.html#iftas-rebit" }
    ]
  }
]
